{
  "schema_version": "signalforge/technology20-standalone-journeys/v1",
  "universe_id": "us-technology-20-v2",
  "split": "development",
  "as_of": "2026-07-24T10:32:53.677641Z",
  "policy_version": "technology20-standalone-journey-policy/v1",
  "cases": [
    {
      "journey_id": "ADBE-fundamentals",
      "company_id": "sec-cik:0000796343",
      "primary_ticker": "ADBE",
      "question_id": "fundamentals",
      "question": "Using only point-in-time authorized evidence, explain Adobe's latest revenue growth, operating margin, and cash conversion. State unavailable measures explicitly.",
      "required_domains": [
        "accounting",
        "financial_quality"
      ],
      "expected_receipts": [
        "financial.cash_conversion",
        "financial.operating_margin",
        "financial.revenue_growth"
      ],
      "expected_abstentions": [],
      "expected_disposition": "deterministic_supported",
      "financial_report_sha256": "9b8aa06744799605024ac62cacc644d4598cacbe9e2bb00168b2c35900e8aa8e"
    },
    {
      "journey_id": "ADBE-cash-quality",
      "company_id": "sec-cik:0000796343",
      "primary_ticker": "ADBE",
      "question_id": "cash-quality",
      "question": "Assess Adobe's cash-generation quality using operating cash flow, approved capex, simple FCF, and earnings quality. Do not present simple FCF as FCFF.",
      "required_domains": [
        "financial_quality"
      ],
      "expected_receipts": [
        "financial.capex_intensity",
        "financial.free_cash_flow",
        "financial.quality_of_earnings"
      ],
      "expected_abstentions": [],
      "expected_disposition": "deterministic_supported",
      "financial_report_sha256": "9b8aa06744799605024ac62cacc644d4598cacbe9e2bb00168b2c35900e8aa8e"
    },
    {
      "journey_id": "ADBE-accounting-integrity",
      "company_id": "sec-cik:0000796343",
      "primary_ticker": "ADBE",
      "question_id": "accounting-integrity",
      "question": "Check Adobe's latest available balance-sheet identity and explain the period, perimeter, and evidence limitations.",
      "required_domains": [
        "accounting"
      ],
      "expected_receipts": [
        "accounting.balance_sheet_identity"
      ],
      "expected_abstentions": [],
      "expected_disposition": "deterministic_supported",
      "financial_report_sha256": "9b8aa06744799605024ac62cacc644d4598cacbe9e2bb00168b2c35900e8aa8e"
    },
    {
      "journey_id": "ADBE-risk-monitoring",
      "company_id": "sec-cik:0000796343",
      "primary_ticker": "ADBE",
      "question_id": "risk-monitoring",
      "question": "Identify the main operating risks and monitoring conditions for Adobe, separating filed facts, management assertions, and hypotheses.",
      "required_domains": [
        "business",
        "market_behavior",
        "evidence"
      ],
      "expected_receipts": [],
      "expected_abstentions": [
        "narrative.investor_relations"
      ],
      "expected_disposition": "typed_abstention",
      "financial_report_sha256": "9b8aa06744799605024ac62cacc644d4598cacbe9e2bb00168b2c35900e8aa8e"
    },
    {
      "journey_id": "AMD-fundamentals",
      "company_id": "sec-cik:0000002488",
      "primary_ticker": "AMD",
      "question_id": "fundamentals",
      "question": "Using only point-in-time authorized evidence, explain Advanced Micro Devices's latest revenue growth, operating margin, and cash conversion. State unavailable measures explicitly.",
      "required_domains": [
        "accounting",
        "financial_quality"
      ],
      "expected_receipts": [
        "financial.cash_conversion",
        "financial.operating_margin",
        "financial.revenue_growth"
      ],
      "expected_abstentions": [],
      "expected_disposition": "deterministic_supported",
      "financial_report_sha256": "f2505f1865888f14cf83fa95c2f0647cabcf2d0f61933be9049d090e0e4ab9af"
    },
    {
      "journey_id": "AMD-cash-quality",
      "company_id": "sec-cik:0000002488",
      "primary_ticker": "AMD",
      "question_id": "cash-quality",
      "question": "Assess Advanced Micro Devices's cash-generation quality using operating cash flow, approved capex, simple FCF, and earnings quality. Do not present simple FCF as FCFF.",
      "required_domains": [
        "financial_quality"
      ],
      "expected_receipts": [
        "financial.capex_intensity",
        "financial.free_cash_flow",
        "financial.quality_of_earnings"
      ],
      "expected_abstentions": [],
      "expected_disposition": "deterministic_supported",
      "financial_report_sha256": "f2505f1865888f14cf83fa95c2f0647cabcf2d0f61933be9049d090e0e4ab9af"
    },
    {
      "journey_id": "AMD-accounting-integrity",
      "company_id": "sec-cik:0000002488",
      "primary_ticker": "AMD",
      "question_id": "accounting-integrity",
      "question": "Check Advanced Micro Devices's latest available balance-sheet identity and explain the period, perimeter, and evidence limitations.",
      "required_domains": [
        "accounting"
      ],
      "expected_receipts": [],
      "expected_abstentions": [
        "accounting.balance_sheet_identity"
      ],
      "expected_disposition": "typed_abstention",
      "financial_report_sha256": "f2505f1865888f14cf83fa95c2f0647cabcf2d0f61933be9049d090e0e4ab9af"
    },
    {
      "journey_id": "AMD-risk-monitoring",
      "company_id": "sec-cik:0000002488",
      "primary_ticker": "AMD",
      "question_id": "risk-monitoring",
      "question": "Identify the main operating risks and monitoring conditions for Advanced Micro Devices, separating filed facts, management assertions, and hypotheses.",
      "required_domains": [
        "business",
        "market_behavior",
        "evidence"
      ],
      "expected_receipts": [],
      "expected_abstentions": [
        "narrative.investor_relations"
      ],
      "expected_disposition": "typed_abstention",
      "financial_report_sha256": "f2505f1865888f14cf83fa95c2f0647cabcf2d0f61933be9049d090e0e4ab9af"
    },
    {
      "journey_id": "GOOGL-fundamentals",
      "company_id": "sec-cik:0001652044",
      "primary_ticker": "GOOGL",
      "question_id": "fundamentals",
      "question": "Using only point-in-time authorized evidence, explain Alphabet's latest revenue growth, operating margin, and cash conversion. State unavailable measures explicitly.",
      "required_domains": [
        "accounting",
        "financial_quality"
      ],
      "expected_receipts": [
        "financial.cash_conversion",
        "financial.operating_margin",
        "financial.revenue_growth"
      ],
      "expected_abstentions": [],
      "expected_disposition": "deterministic_supported",
      "financial_report_sha256": "c1b512ad95742350cfec8f95bf708eeb529cc4fe9af592e34ce8d649f9ea3738"
    },
    {
      "journey_id": "GOOGL-cash-quality",
      "company_id": "sec-cik:0001652044",
      "primary_ticker": "GOOGL",
      "question_id": "cash-quality",
      "question": "Assess Alphabet's cash-generation quality using operating cash flow, approved capex, simple FCF, and earnings quality. Do not present simple FCF as FCFF.",
      "required_domains": [
        "financial_quality"
      ],
      "expected_receipts": [
        "financial.capex_intensity",
        "financial.free_cash_flow",
        "financial.quality_of_earnings"
      ],
      "expected_abstentions": [],
      "expected_disposition": "deterministic_supported",
      "financial_report_sha256": "c1b512ad95742350cfec8f95bf708eeb529cc4fe9af592e34ce8d649f9ea3738"
    },
    {
      "journey_id": "GOOGL-accounting-integrity",
      "company_id": "sec-cik:0001652044",
      "primary_ticker": "GOOGL",
      "question_id": "accounting-integrity",
      "question": "Check Alphabet's latest available balance-sheet identity and explain the period, perimeter, and evidence limitations.",
      "required_domains": [
        "accounting"
      ],
      "expected_receipts": [
        "accounting.balance_sheet_identity"
      ],
      "expected_abstentions": [],
      "expected_disposition": "deterministic_supported",
      "financial_report_sha256": "c1b512ad95742350cfec8f95bf708eeb529cc4fe9af592e34ce8d649f9ea3738"
    },
    {
      "journey_id": "GOOGL-risk-monitoring",
      "company_id": "sec-cik:0001652044",
      "primary_ticker": "GOOGL",
      "question_id": "risk-monitoring",
      "question": "Identify the main operating risks and monitoring conditions for Alphabet, separating filed facts, management assertions, and hypotheses.",
      "required_domains": [
        "business",
        "market_behavior",
        "evidence"
      ],
      "expected_receipts": [],
      "expected_abstentions": [
        "narrative.investor_relations"
      ],
      "expected_disposition": "typed_abstention",
      "financial_report_sha256": "c1b512ad95742350cfec8f95bf708eeb529cc4fe9af592e34ce8d649f9ea3738"
    },
    {
      "journey_id": "AMZN-fundamentals",
      "company_id": "sec-cik:0001018724",
      "primary_ticker": "AMZN",
      "question_id": "fundamentals",
      "question": "Using only point-in-time authorized evidence, explain Amazon's latest revenue growth, operating margin, and cash conversion. State unavailable measures explicitly.",
      "required_domains": [
        "accounting",
        "financial_quality"
      ],
      "expected_receipts": [
        "financial.cash_conversion",
        "financial.operating_margin",
        "financial.revenue_growth"
      ],
      "expected_abstentions": [],
      "expected_disposition": "deterministic_supported",
      "financial_report_sha256": "86b0ceda8e6226d627748d05c1163394e302147afc2f780aff0491e89b9773ea"
    },
    {
      "journey_id": "AMZN-cash-quality",
      "company_id": "sec-cik:0001018724",
      "primary_ticker": "AMZN",
      "question_id": "cash-quality",